{"schemaVersion":2,"issue":{"title":"AMR 선택","symptom":null,"improvementReq":"확정 요구사항에 따라 AMR을 선택한다.","changeScope":null,"constraintsNote":null,"beforeState":null,"afterState":null},"outputs":[{"type":"VOC","status":"SUCCEEDED","content":{"requester":null,"requestContent":"확정 요구사항에 따라 AMR을 선택한다.","specialNotes":null,"legacyExtras":{}},"errors":[]}],"engine":"rule"}
